trabeate,"not arcuate; having straight horizontal beams or lintels (rather than arches)"
trace,"a just detectable amount; "he speaks French with a trace of an accent"","an indication that something has been present; "there wasn't a trace of evidence for the claim"; "a tincture of condescension"","a suggestion of some quality; "there was a touch of sarcasm in his tone"; "he detected a ghost of a smile on her face"","a drawing created by superimposing a semitransparent sheet of paper on the original image and copying on it the lines of the original image","either of two lines that connect a horse's harness to a wagon or other vehicle or to a whiffletree","a visible mark (as a footprint) left by the passage of person or animal or vehicle","follow, discover, or ascertain the course of development of something; "We must follow closely the economic development is Cuba" ; "trace the student's progress"","make a mark or lines on a surface; "draw a line"; "trace the outline of a figure in the sand"","to go back over again; "we retraced the route we took last summer"; "trace your path"","pursue or chase relentlessly; "The hunters traced the deer into the woods"; "the detectives hounded the suspect until they found him"","discover traces of; "She traced the circumstances of her birth"","make one's course or travel along a path; travel or pass over, around, or along; "The children traced along the edge of the dark forest"; "The women traced the pasture"","copy by following the lines of the original drawing on a transparent sheet placed upon it; make a tracing of; "trace a design"; "trace a pattern"","read with difficulty; "Can you decipher this letter?"; "The archeologist traced the hieroglyphs""
traceable,"(usually followed by `to') able to be traced to; "a failure traceable to lack of energy"","capable of being traced or tracked; "a traceable riverbed"; "the traceable course of an ancient wall""
traced
tracer,"an investigator who is employed to find missing persons or missing goods","an instrument used to make tracings","(radiology) any radioactive isotope introduced into the body to study metabolism or other biological processes","ammunition whose flight can be observed by a trail of smoke"
traceries
tracers,"an investigator who is employed to find missing persons or missing goods","an instrument used to make tracings","(radiology) any radioactive isotope introduced into the body to study metabolism or other biological processes","ammunition whose flight can be observed by a trail of smoke"
tracery,"decoration consisting of an open pattern of interlacing ribs"
traces,"a just detectable amount; "he speaks French with a trace of an accent"","an indication that something has been present; "there wasn't a trace of evidence for the claim"; "a tincture of condescension"","a suggestion of some quality; "there was a touch of sarcasm in his tone"; "he detected a ghost of a smile on her face"","a drawing created by superimposing a semitransparent sheet of paper on the original image and copying on it the lines of the original image","either of two lines that connect a horse's harness to a wagon or other vehicle or to a whiffletree","a visible mark (as a footprint) left by the passage of person or animal or vehicle","follow, discover, or ascertain the course of development of something; "We must follow closely the economic development is Cuba" ; "trace the student's progress"","make a mark or lines on a surface; "draw a line"; "trace the outline of a figure in the sand"","to go back over again; "we retraced the route we took last summer"; "trace your path"","pursue or chase relentlessly; "The hunters traced the deer into the woods"; "the detectives hounded the suspect until they found him"","discover traces of; "She traced the circumstances of her birth"","make one's course or travel along a path; travel or pass over, around, or along; "The children traced along the edge of the dark forest"; "The women traced the pasture"","copy by following the lines of the original drawing on a transparent sheet placed upon it; make a tracing of; "trace a design"; "trace a pattern"","read with difficulty; "Can you decipher this letter?"; "The archeologist traced the hieroglyphs""
trachea,"membranous tube with cartilaginous rings that conveys inhaled air from the larynx to the bronchi","one of the tubules forming the respiratory system of most insects and many arachnids"
tracheae,"membranous tube with cartilaginous rings that conveys inhaled air from the larynx to the bronchi","one of the tubules forming the respiratory system of most insects and many arachnids"
tracheal,"relating to or resembling or functioning like a trachea"
tracheas,"membranous tube with cartilaginous rings that conveys inhaled air from the larynx to the bronchi","one of the tubules forming the respiratory system of most insects and many arachnids"
tracheid,"long tubular cell peculiar to xylem"
tracheids,"long tubular cell peculiar to xylem"
tracherous
tracherously
trachle
trachled
trachles
trachling
trachoma,"a chronic contagious viral disease marked by inflammation of the conjunctiva and cornea of the eye and the formation of scar tissue"
trachomas,"a chronic contagious viral disease marked by inflammation of the conjunctiva and cornea of the eye and the formation of scar tissue"
trachyte
trachytes
tracing,"the act of drawing a plan or diagram or outline","a drawing created by superimposing a semitransparent sheet of paper on the original image and copying on it the lines of the original image","the discovery and description of the course of development of something; "the tracing of genealogies""
tracings,"the act of drawing a plan or diagram or outline","a drawing created by superimposing a semitransparent sheet of paper on the original image and copying on it the lines of the original image","the discovery and description of the course of development of something; "the tracing of genealogies""
track,"a line or route along which something travels or moves; "the hurricane demolished houses in its path"; "the track of an animal"; "the course of the river"","evidence pointing to a possible solution; "the police are following a promising lead"; "the trail led straight to the perpetrator"","a pair of parallel rails providing a runway for wheels","a course over which races are run","a distinct selection of music from a recording or a compact disc; "he played the first cut on the cd"; "the title track of the album"","an endless metal belt on which tracked vehicles move over the ground","(computer science) one of the circular magnetic paths on a magnetic disk that serve as a guide for writing and reading data","a groove on a phonograph recording","a bar or pair of parallel bars of rolled steel making the railway along which railroad cars or other vehicles can roll","any road or path affording passage especially a rough one","the act of participating in an athletic competition involving running on a track","carry on the feet and deposit; "track mud into the house"","observe or plot the moving path of something; "track a missile"","go after with the intent to catch; "The policeman chased the mugger down the alley"; "the dog chased the rabbit"","travel across or pass over; "The caravan covered almost 100 miles each day"","make tracks upon"
trackage
trackages
tracked,"having tracks; "new snow tracked by rabbits"; "tracked vehicles""
tracker,"someone who tracks down game"
trackers,"someone who tracks down game"
tracking,"the pursuit (of a person or animal) by following tracks or marks they left behind"
trackings,"the pursuit (of a person or animal) by following tracks or marks they left behind"
trackman
trackmen
tracks,"a line or route along which something travels or moves; "the hurricane demolished houses in its path"; "the track of an animal"; "the course of the river"","evidence pointing to a possible solution; "the police are following a promising lead"; "the trail led straight to the perpetrator"","a pair of parallel rails providing a runway for wheels","a course over which races are run","a distinct selection of music from a recording or a compact disc; "he played the first cut on the cd"; "the title track of the album"","an endless metal belt on which tracked vehicles move over the ground","(computer science) one of the circular magnetic paths on a magnetic disk that serve as a guide for writing and reading data","a groove on a phonograph recording","a bar or pair of parallel bars of rolled steel making the railway along which railroad cars or other vehicles can roll","any road or path affording passage especially a rough one","the act of participating in an athletic competition involving running on a track","carry on the feet and deposit; "track mud into the house"","observe or plot the moving path of something; "track a missile"","go after with the intent to catch; "The policeman chased the mugger down the alley"; "the dog chased the rabbit"","travel across or pass over; "The caravan covered almost 100 miles each day"","make tracks upon"
tract,"an extended area of land","a system of body parts that together serve some particular purpose","a brief treatise on a subject of interest; published in the form of a booklet","a bundle of myelinated nerve fibers following a path through the brain"
tractable,"easily managed (controlled or taught or molded); "tractable young minds"; "the natives...being...of an intelligent tractable disposition"- Samuel Butler","readily reacting to suggestions and influences; "a responsive student""
tractate
tractates
tractile,"capable of being shaped or bent or drawn out; "ductile copper"; "malleable metals such as gold"; "they soaked the leather to made it pliable"; "pliant molten glass"; "made of highly tensile steel alloy""
traction,"the friction between a body and the surface on which it moves (as between an automobile tire and the road)","(orthopedics) the act of pulling on a bone or limb (as in a fracture) to relieve pressure or align parts in a special way during healing; "his leg was in traction for several days""
tractional
tractions,"the friction between a body and the surface on which it moves (as between an automobile tire and the road)","(orthopedics) the act of pulling on a bone or limb (as in a fracture) to relieve pressure or align parts in a special way during healing; "his leg was in traction for several days""
tractive,"exerting traction and serving to pull"
tractor,"a wheeled vehicle with large wheels; used in farming and other applications","a truck that has a cab but no body; used for pulling large trailers or vans"
tractors,"a wheeled vehicle with large wheels; used in farming and other applications","a truck that has a cab but no body; used for pulling large trailers or vans"
tracts,"an extended area of land","a system of body parts that together serve some particular purpose","a brief treatise on a subject of interest; published in the form of a booklet","a bundle of myelinated nerve fibers following a path through the brain"
trad,"traditional jazz as revived in the 1950s"
tradable
trade,"the commercial exchange (buying and selling on domestic or international markets) of goods and services; "Venice was an important center of trade with the East"; "they are accused of conspiring to constrain trade"","the skilled practice of a practical occupation; "he learned his trade as an apprentice"","the business given to a commercial establishment by its customers; "even before noon there was a considerable patronage"","a particular instance of buying or selling; "it was a package deal"; "I had no further trade with him"; "he's a master of the business deal"","people who perform a particular kind of skilled work; "he represented the craft of brewers"; "as they say in the trade"","steady winds blowing from east to west above and below the equator; "they rode the trade winds going west"","an equal exchange; "we had no money so we had to live by barter"","engage in the trade of; "he is merchandising telephone sets"","turn in as payment or part payment for a purchase; "trade in an old car for a new one"","be traded at a certain price or under certain conditions; "The stock traded around $20 a share"","exchange or give (something) in exchange for","do business; offer for sale as for one's livelihood; "She deals in gold"; "The brothers sell shoes""
traded
trademark,"a distinctive characteristic or attribute","a formally registered symbol identifying the manufacturer or distributor of a product","mark with a brand or trademark; "when this product is not branded it sells for a lower price"","register the trademark of; "The company trademarked their new gadget""
trademarked,"(of goods and merchandise) labeled with proprietary (and legally registered) identification guaranteeing exclusive use; "trademarked goods""
trademarking
trademarks,"a distinctive characteristic or attribute","a formally registered symbol identifying the manufacturer or distributor of a product","mark with a brand or trademark; "when this product is not branded it sells for a lower price"","register the trademark of; "The company trademarked their new gadget""
trader,"someone who purchases and maintains an inventory of goods to be sold"
traders,"someone who purchases and maintains an inventory of goods to be sold"
trades,"the commercial exchange (buying and selling on domestic or international markets) of goods and services; "Venice was an important center of trade with the East"; "they are accused of conspiring to constrain trade"","the skilled practice of a practical occupation; "he learned his trade as an apprentice"","the business given to a commercial establishment by its customers; "even before noon there was a considerable patronage"","a particular instance of buying or selling; "it was a package deal"; "I had no further trade with him"; "he's a master of the business deal"","people who perform a particular kind of skilled work; "he represented the craft of brewers"; "as they say in the trade"","steady winds blowing from east to west above and below the equator; "they rode the trade winds going west"","an equal exchange; "we had no money so we had to live by barter"","engage in the trade of; "he is merchandising telephone sets"","turn in as payment or part payment for a purchase; "trade in an old car for a new one"","be traded at a certain price or under certain conditions; "The stock traded around $20 a share"","exchange or give (something) in exchange for","do business; offer for sale as for one's livelihood; "She deals in gold"; "The brothers sell shoes""
tradesman,"a merchant who owns or manages a shop"
tradesmen
tradespeople,"people engaged in trade"
trading,"buying or selling securities or commodities"
tradition,"an inherited pattern of thought or action","a specific practice of long standing"
traditional,"consisting of or derived from tradition; "traditional history"; "traditional morality"","pertaining to time-honored orthodox doctrines; "the simple security of traditional assumptions has vanished""
traditionally,"according to tradition; in a traditional manner; "traditionally, we eat fried foods on Hanukah""
traditions,"an inherited pattern of thought or action","a specific practice of long standing"
traditor
traditores
traduce,"speak unfavorably about; "She badmouths her husband everywhere""
traduced
traducer,"one who attacks the reputation of another by slander or libel"
traducers,"one who attacks the reputation of another by slander or libel"
traduces,"speak unfavorably about; "She badmouths her husband everywhere""
traducing
traffic,"the aggregation of things (pedestrians or vehicles) coming and going in a particular locality during a specified period of time","buying and selling; especially illicit trade","the amount of activity over a communication system during a given period of time; "heavy traffic overloaded the trunk lines"; "traffic on the internet is lightest during the night"","social or verbal interchange (usually followed by `with')","deal illegally; "traffic drugs"","trade or deal a commodity; "They trafficked with us for gold""
trafficked,"deal illegally; "traffic drugs"","trade or deal a commodity; "They trafficked with us for gold""
trafficker,"someone who promotes or exchanges goods or services for money"
traffickers,"someone who promotes or exchanges goods or services for money"
trafficking,"deal illegally; "traffic drugs"","trade or deal a commodity; "They trafficked with us for gold""
traffics,"the aggregation of things (pedestrians or vehicles) coming and going in a particular locality during a specified period of time","buying and selling; especially illicit trade","the amount of activity over a communication system during a given period of time; "heavy traffic overloaded the trunk lines"; "traffic on the internet is lightest during the night"","social or verbal interchange (usually followed by `with')","deal illegally; "traffic drugs"","trade or deal a commodity; "They trafficked with us for gold""
tragedies
tragedy,"an event resulting in great loss and misfortune; "the whole city was affected by the irremediable calamity"; "the earthquake was a disaster"","drama in which the protagonist is overcome by some superior force or circumstance; excites terror or pity"
tragi,"a small cartilaginous flap in front of the external opening of the ear"
tragic,"very sad; especially involving grief or death or destruction; "a tragic face"; "a tragic plight"; "a tragic accident"","of or relating to or characteristic of tragedy; "tragic hero""
tragical,"very sad; especially involving grief or death or destruction; "a tragic face"; "a tragic plight"; "a tragic accident""
tragically,"in a tragic manner; with tragic consequences; "the adventure ended tragically"; "tragically, she contracted AIDS""
tragopan,"brilliantly colored Asian pheasant having wattles and two fleshy processes on the head"
tragopans,"brilliantly colored Asian pheasant having wattles and two fleshy processes on the head"
tragus,"a small cartilaginous flap in front of the external opening of the ear"
traik
traiked
traiking
traiks
trail,"a track or mark left by something that has passed; "there as a trail of blood"; "a tear left its trail on her cheek"","a path or track roughly blazed through wild or hilly country","evidence pointing to a possible solution; "the police are following a promising lead"; "the trail led straight to the perpetrator"","to lag or linger behind; "But in so many other areas we still are dragging"","go after with the intent to catch; "The policeman chased the mugger down the alley"; "the dog chased the rabbit"","move, proceed, or walk draggingly or slowly; "John trailed behind his class mates"; "The Mercedes trailed behind the horse cart"","hang down so as to drag along the ground; "The bride's veiled trailed along the ground"","drag loosely along a surface; allow to sweep the ground; "The toddler was trailing his pants"; "She trained her long scarf behind her""
trailed
trailer,"someone who takes more time than necessary; someone who lags behind","an advertisement consisting of short scenes from a motion picture that will appear in the near future","a large transport conveyance designed to be pulled by a truck or tractor","a wheeled vehicle that can be pulled by a car or truck and is equipped for occupancy"
trailered
trailering
trailers,"someone who takes more time than necessary; someone who lags behind","an advertisement consisting of short scenes from a motion picture that will appear in the near future","a large transport conveyance designed to be pulled by a truck or tractor","a wheeled vehicle that can be pulled by a car or truck and is equipped for occupancy"
trailing,"the pursuit (of a person or animal) by following tracks or marks they left behind"
trails,"a track or mark left by something that has passed; "there as a trail of blood"; "a tear left its trail on her cheek"","a path or track roughly blazed through wild or hilly country","evidence pointing to a possible solution; "the police are following a promising lead"; "the trail led straight to the perpetrator"","to lag or linger behind; "But in so many other areas we still are dragging"","go after with the intent to catch; "The policeman chased the mugger down the alley"; "the dog chased the rabbit"","move, proceed, or walk draggingly or slowly; "John trailed behind his class mates"; "The Mercedes trailed behind the horse cart"","hang down so as to drag along the ground; "The bride's veiled trailed along the ground"","drag loosely along a surface; allow to sweep the ground; "The toddler was trailing his pants"; "She trained her long scarf behind her""
train,"public transport provided by a line of railway cars coupled together and drawn by a locomotive; "express trains don't stop at Princeton Junction"","a sequentially ordered set of things or events or ideas in which each successive member is related to the preceding; "a string of islands"; "train of mourners"; "a train of thought"","a procession (of wagons or mules or camels) traveling together in single file; "we were part of a caravan of almost a thousand camels"; "they joined the wagon train for safety"","a series of consequences wrought by an event; "it led to a train of disasters"","piece of cloth forming the long back section of a gown that is drawn along the floor; "the bride's train was carried by her two young nephews"","wheelwork consisting of a connected set of rotating gears by which force is transmitted or motion or torque is changed; "the fool got his tie caught in the geartrain"","create by training and teaching; "The old master is training world-class violinists"; "we develop the leaders for the future"","undergo training or instruction in preparation for a particular role, function, or profession; "She is training to be a teacher"; "He trained as a legal aid"","develop (children's) behavior by instruction and practice; especially to teach self-control; "Parents must discipline their children"; "Is this dog trained?"","educate for a future role or function; "He is grooming his son to become his successor"; "The prince was prepared to become King one day"; "They trained him to be a warrior"","teach or refine to be discriminative in taste or judgment; "Cultivate your musical taste"; "Train your tastebuds"; "She is well schooled in poetry"","point or cause to go (blows, weapons, or objects such as photographic equipment) towards; "Please don't aim at your little brother!"; "He trained his gun on the burglar"; "Don't train your camera on the women"; "Take a swipe at one's opponent"","teach and supervise (someone); act as a trainer or coach (to), as in sports; "He is training our Olympic team"; "She is coaching the crew"","exercise in order to prepare for an event or competition; "She is training for the Olympics"","cause to grow in a certain way by tying and pruning it; "train the vine"","travel by rail or train; "They railed from Rome to Venice"; "She trained to Hamburg"","drag loosely along a surface; allow to sweep the ground; "The toddler was trailing his pants"; "She trained her long scarf behind her""
trained,"shaped or conditioned or disciplined by training; often used as a combining form; "a trained mind"; "trained pigeons"; "well-trained servants""
trainee,"someone who is being trained"
trainees,"someone who is being trained"
trainer,"one who trains other persons or animals","simulator consisting of a machine on the ground that simulates the conditions of flying a plane"
trainers,"one who trains other persons or animals","simulator consisting of a machine on the ground that simulates the conditions of flying a plane"
trainful
trainfuls
training,"activity leading to skilled behavior","the result of good upbringing (especially knowledge of correct social behavior); "a woman of breeding and refinement""
trainings,"activity leading to skilled behavior","the result of good upbringing (especially knowledge of correct social behavior); "a woman of breeding and refinement""
trainload,"quantity that can be carried by a train"
trainloads,"quantity that can be carried by a train"
trainman,"an employee of a railroad"
trainmen
